,Unnamed: 0,Unnamed: 0.1,title,director,description,duration,year,budget,genre,profitable,is_Animation,is_Biography,is_Action,is_Mystery,is_Sci-Fi,is_Comedy,is_Fantasy,is_Sport,is_Thriller,is_Film-Noir,is_Drama,is_Adventure,is_Horror,is_Musical,is_History,is_Crime,is_Music,is_Family,is_Romance,is_Western,is_War,text,nb_prediction,correct
4425,4425,71243,avengers endgame,anthony russo joe russo,after devastating events,181,2019,356000000,"Action, Adventure, Drama",1,0,0,1,0,0,0,0,0,0,0,1,1,0,0,0,0,0,0,0,0,0,avengers endgame anthony russo joe russo after devastating events,1,1
2662,2662,40522,constellation,jordan walkerpearlman,a painter living exile returns home family endured generations racial violence there begins fantasize people around series portraits order bury pain find something beautiful feel,96,2005,7200000,Drama,0,0,0,0,0,0,0,0,0,0,0,1,0,0,0,0,0,0,0,0,0,0,constellation jordan walkerpearlman a painter living exile returns home family endured generations racial violence there begins fantasize people around series portraits order bury pain find something beautiful feel,1,0
644,644,22442,extreme prejudice,walter hill,a texas ranger ruthless narcotics kingpin  childhood friends adversaries,96,1987,22000000,"Action, Crime, Drama",0,0,0,1,0,0,0,0,0,0,0,1,0,0,0,0,1,0,0,0,0,0,extreme prejudice walter hill a texas ranger ruthless narcotics kingpin  childhood friends adversaries,0,1
632,632,22793,sister sister,bill condon,two sisters turn family mansion louisiana guest house one guests aide congressman turns lives inside out,91,1987,4000000,"Drama, Mystery, Romance",0,0,0,0,1,0,0,0,0,0,0,1,0,0,0,0,0,0,0,1,0,0,sister sister bill condon two sisters turn family mansion louisiana guest house one guests aide congressman turns lives inside out,1,0
3710,3710,61009,one small hitch,john burgess,joshs girlfriend wants get married mollys boyfriend married josh molly fly together wedding chicago pretending engaged make parents happy comedy follows romance,105,2013,500000,"Comedy, Romance",0,0,0,0,0,0,1,0,0,0,0,0,0,0,0,0,0,0,0,1,0,0,one small hitch john burgess joshs girlfriend wants get married mollys boyfriend married josh molly fly together wedding chicago pretending engaged make parents happy comedy follows romance,1,0
3400,3400,50535,little fockers,paul weitz,familypatriarch jack byrnes wants appoint successor does soninlaw male nurse greg focker takes,98,2010,100000000,"Comedy, Romance",1,0,0,0,0,0,1,0,0,0,0,0,0,0,0,0,0,0,0,1,0,0,little fockers paul weitz familypatriarch jack byrnes wants appoint successor does soninlaw male nurse greg focker takes,1,1
2299,2299,31399,treasure planet,ron clements john musker,a disney animated version treasure island the difference film set outer space alien worlds galactic wonders,95,2002,140000000,"Animation, Adventure, Family",0,1,0,0,0,0,0,0,0,0,0,0,1,0,0,0,0,0,1,0,0,0,treasure planet ron clements john musker a disney animated version treasure island the difference film set outer space alien worlds galactic wonders,1,0
4287,4287,66494,the shack,stuart hazeldine,a grieving man receives mysterious personal invitation meet god place called the shack,132,2017,20000000,"Drama, Fantasy",1,0,0,0,0,0,0,1,0,0,0,1,0,0,0,0,0,0,0,0,0,0,the shack stuart hazeldine a grieving man receives mysterious personal invitation meet god place called the shack,1,1
1992,1992,35789,trois,rob hardy,jermaine young struggling atlanta lawyer decides spruce marriage jasmine whos mentally recovering abusive previous relationship hiring jade bisexual ,93,2000,200000,"Romance, Thriller",1,0,0,0,0,0,0,0,0,1,0,0,0,0,0,0,0,0,0,1,0,0,trois rob hardy jermaine young struggling atlanta lawyer decides spruce marriage jasmine whos mentally recovering abusive previous relationship hiring jade bisexual ,1,1
3091,3091,51720,the secrets of jonathan sperry,rich christiano,a wise old christian man imparts biblical truths three boys summer 1970,96,2008,900000,Drama,1,0,0,0,0,0,0,0,0,0,0,1,0,0,0,0,0,0,0,0,0,0,the secrets of jonathan sperry rich christiano a wise old christian man imparts biblical truths three boys summer 1970,1,1
2379,2379,40530,21 grams,alejandro g iñárritu,a freak accident brings together critically ill mathematician grieving mother bornagain excon,124,2003,20000000,"Crime, Drama, Thriller",1,0,0,0,0,0,0,0,0,1,0,1,0,0,0,0,1,0,0,0,0,0,21 grams alejandro g iñárritu a freak accident brings together critically ill mathematician grieving mother bornagain excon,1,1
1089,1089,25730,death becomes her,robert zemeckis,when woman learns immortality treatment sees way outdo longtime rival,104,1992,55000000,"Comedy, Fantasy, Horror",1,0,0,0,0,0,1,1,0,0,0,0,0,1,0,0,0,0,0,0,0,0,death becomes her robert zemeckis when woman learns immortality treatment sees way outdo longtime rival,1,1
3814,3814,48480,ripd,robert schwentke,a recently slain cop joins team undead police officers working rest peace department tries find man murdered him,96,2013,130000000,"Action, Adventure, Comedy",0,0,0,1,0,0,1,0,0,0,0,0,1,0,0,0,0,0,0,0,0,0,ripd robert schwentke a recently slain cop joins team undead police officers working rest peace department tries find man murdered him,1,0
3777,3777,61105,the hangover part iii,todd phillips,when one kidnapped angry gangster wolf pack must track mr chow escaped prison run,100,2013,103000000,"Comedy, Crime",1,0,0,0,0,0,1,0,0,0,0,0,0,0,0,0,1,0,0,0,0,0,the hangover part iii todd phillips when one kidnapped angry gangster wolf pack must track mr chow escaped prison run,1,1
3239,3239,53131,up in the air,jason reitman,ryan bingham enjoys living suitcase job travelling around country firing people finds lifestyle threatened presence potential love interest new hire,109,2009,25000000,"Comedy, Drama, Romance",1,0,0,0,0,0,1,0,0,0,0,1,0,0,0,0,0,0,0,1,0,0,up in the air jason reitman ryan bingham enjoys living suitcase job travelling around country firing people finds lifestyle threatened presence potential love interest new hire,1,1
566,566,21702,avenging force,sam firstenberg,a senator targeted pentangle right wing paramilitary group his pal former cia agent martial artist tries help him the group kidnaps agents sister tries hunt down the most dangerous game style,104,1986,4000000,"Action, Drama, Thriller",1,0,0,1,0,0,0,0,0,1,0,1,0,0,0,0,0,0,0,0,0,0,avenging force sam firstenberg a senator targeted pentangle right wing paramilitary group his pal former cia agent martial artist tries help him the group kidnaps agents sister tries hunt down the most dangerous game style,1,1
331,331,19591,annie,john huston,a young orphan girls adventures finding family take her,126,1982,50000000,"Comedy, Drama, Family",1,0,0,0,0,0,1,0,0,0,0,1,0,0,0,0,0,0,1,0,0,0,annie john huston a young orphan girls adventures finding family take her,1,1
329,329,19574,48 hrs,walter hill,a hardnosed cop reluctantly teams wisecracking criminal temporarily paroled him order track killer,96,1982,12000000,"Action, Comedy, Crime",1,0,0,1,0,0,1,0,0,0,0,0,0,0,0,0,1,0,0,0,0,0,48 hrs walter hill a hardnosed cop reluctantly teams wisecracking criminal temporarily paroled him order track killer,1,1
3243,3243,49337,cloudy with a chance of meatballs,phil lord christopher miller,a local scientist often regarded failure invents machine make food fall sky but little know things take turn worst,90,2009,100000000,"Animation, Adventure, Comedy",1,1,0,0,0,0,1,0,0,0,0,0,1,0,0,0,0,0,0,0,0,0,cloudy with a chance of meatballs phil lord christopher miller a local scientist often regarded failure invents machine make food fall sky but little know things take turn worst,1,1
3847,3847,58873,seasons of gray,paul stehlik jr,hated betrayed brothers brady gray forced family ranch must start new life dallas with good job promising romance better days seem lay ahead brady framed crime commit,90,2013,500000,Drama,0,0,0,0,0,0,0,0,0,0,0,1,0,0,0,0,0,0,0,0,0,0,seasons of gray paul stehlik jr hated betrayed brothers brady gray forced family ranch must start new life dallas with good job promising romance better days seem lay ahead brady framed crime commit,1,0
1702,1702,29850,hurlyburly,anthony drazan,hollywood movers shakers dissect personal lives everything seems clash together,122,1998,15000000,"Comedy, Drama",0,0,0,0,0,0,1,0,0,0,0,1,0,0,0,0,0,0,0,0,0,0,hurlyburly anthony drazan hollywood movers shakers dissect personal lives everything seems clash together,1,0
4444,4444,78112,us,jordan peele,a familys serene beach vacation turns chaos doppelgängers appear begin terrorize them,116,2019,20000000,"Horror, Mystery, Thriller",1,0,0,0,1,0,0,0,0,1,0,0,0,1,0,0,0,0,0,0,0,0,us jordan peele a familys serene beach vacation turns chaos doppelgängers appear begin terrorize them,1,1
1238,1238,26432,dragon the bruce lee story,rob cohen,a fictionalized account life martial arts superstar,120,1993,14000000,"Action, Biography, Drama",1,0,1,1,0,0,0,0,0,0,0,1,0,0,0,0,0,0,0,0,0,0,dragon the bruce lee story rob cohen a fictionalized account life martial arts superstar,1,1
3159,3159,46041,the time travelers wife,robert schwentke,a chicago librarian gene causes involuntarily time travel creating complications marriage,107,2009,39000000,"Drama, Fantasy, Romance",1,0,0,0,0,0,0,1,0,0,0,1,0,0,0,0,0,0,0,1,0,0,the time travelers wife robert schwentke a chicago librarian gene causes involuntarily time travel creating complications marriage,1,1
921,921,24440,desperate hours,michael cimino,an escaped con run law moves married couples house takes lives,105,1990,18000000,"Action, Crime, Drama",0,0,0,1,0,0,0,0,0,0,0,1,0,0,0,0,1,0,0,0,0,0,desperate hours michael cimino an escaped con run law moves married couples house takes lives,1,0
4343,4343,75623,the possession of hannah grace,diederik van rooijen,when cop rehab takes graveyard shift city hospital morgue faces series bizarre violent events caused evil entity one corpses,86,2018,7700000,"Horror, Mystery, Thriller",1,0,0,0,1,0,0,0,0,1,0,0,0,1,0,0,0,0,0,0,0,0,the possession of hannah grace diederik van rooijen when cop rehab takes graveyard shift city hospital morgue faces series bizarre violent events caused evil entity one corpses,1,1
4265,4265,59699,the vault,dan bush,two estranged sisters forced rob bank order save brother but ordinary bank,91,2017,5000000,"Crime, Horror, Mystery",0,0,0,0,1,0,0,0,0,0,0,0,0,1,0,0,1,0,0,0,0,0,the vault dan bush two estranged sisters forced rob bank order save brother but ordinary bank,1,0
787,787,23982,major league,david s ward,the new owner cleveland indians puts together purposely horrible team theyll lose move team but plot uncovered start winning spite her,107,1989,11000000,"Comedy, Sport",1,0,0,0,0,0,1,0,1,0,0,0,0,0,0,0,0,0,0,0,0,0,major league david s ward the new owner cleveland indians puts together purposely horrible team theyll lose move team but plot uncovered start winning spite her,1,1
3180,3180,53228,funny people,judd apatow,when seasoned comedian george simmons learns terminal inoperable health condition desire form genuine friendship causes take relatively green performer wing opening act,146,2009,75000000,"Comedy, Drama",0,0,0,0,0,0,1,0,0,0,0,1,0,0,0,0,0,0,0,0,0,0,funny people judd apatow when seasoned comedian george simmons learns terminal inoperable health condition desire form genuine friendship causes take relatively green performer wing opening act,1,0
4042,4042,70932,do you believe,jon gunn,when pastor shaken visible faith street corner preacher reminded true belief always requires action his response ignites journey impacts everyone touches ways god could orchestrate,120,2015,2300000,Drama,1,0,0,0,0,0,0,0,0,0,0,1,0,0,0,0,0,0,0,0,0,0,do you believe jon gunn when pastor shaken visible faith street corner preacher reminded true belief always requires action his response ignites journey impacts everyone touches ways god could orchestrate,0,0
3867,3867,66530,chef,jon favreau,a head chef quits restaurant job buys food truck effort reclaim creative promise piecing back together estranged family,114,2014,11000000,"Adventure, Comedy, Drama",1,0,0,0,0,0,1,0,0,0,0,1,1,0,0,0,0,0,0,0,0,0,chef jon favreau a head chef quits restaurant job buys food truck effort reclaim creative promise piecing back together estranged family,1,1
3611,3611,59337,the collection,marcus dunstan,a man escapes vicious grips serial killer known the collector forced help rescue innocent girl killers boobytrapped lair,82,2012,7500000,"Horror, Thriller",1,0,0,0,0,0,0,0,0,1,0,0,0,1,0,0,0,0,0,0,0,0,the collection marcus dunstan a man escapes vicious grips serial killer known the collector forced help rescue innocent girl killers boobytrapped lair,1,1
4068,4068,59647,no escape,john erick dowdle,in new overseas house american family soon finds caught middle coup frantically look safe escape environment foreigners immediately executed,103,2015,16200000,"Action, Thriller",1,0,0,1,0,0,0,0,0,1,0,0,0,0,0,0,0,0,0,0,0,0,no escape john erick dowdle in new overseas house american family soon finds caught middle coup frantically look safe escape environment foreigners immediately executed,1,1
4319,4319,78378,eighth grade,bo burnham,an introverted teenage girl tries survive last week disastrous eighth grade year leaving start high school,93,2018,2000000,"Comedy, Drama",1,0,0,0,0,0,1,0,0,0,0,1,0,0,0,0,0,0,0,0,0,0,eighth grade bo burnham an introverted teenage girl tries survive last week disastrous eighth grade year leaving start high school,1,1
21,21,7078,sudden fear,david miller,after ambitious actor insinuates life wealthy middleaged playwright marries her plots mistress murder her,110,1952,720000,"Film-Noir, Thriller",0,0,0,0,0,0,0,0,0,1,1,0,0,0,0,0,0,0,0,0,0,0,sudden fear david miller after ambitious actor insinuates life wealthy middleaged playwright marries her plots mistress murder her,1,0
544,544,22178,¡three amigos,john landis,three actors accept invitation mexican village perform onscreen bandit fighter roles unaware real thing,104,1986,25000000,"Comedy, Western",1,0,0,0,0,0,1,0,0,0,0,0,0,0,0,0,0,0,0,0,1,0,¡three amigos john landis three actors accept invitation mexican village perform onscreen bandit fighter roles unaware real thing,1,1
3521,3521,52316,the ides of march,george clooney,an idealistic staffer new presidential candidate gets crash course dirty politics stint campaign trail,101,2011,12500000,"Drama, Thriller",1,0,0,0,0,0,0,0,0,1,0,1,0,0,0,0,0,0,0,0,0,0,the ides of march george clooney an idealistic staffer new presidential candidate gets crash course dirty politics stint campaign trail,1,1
222,222,18921,ordinary people,robert redford,the accidental death older son affluent family deeply strains relationships among bitter mother goodnatured father guiltridden younger son,124,1980,6000000,Drama,1,0,0,0,0,0,0,0,0,0,0,1,0,0,0,0,0,0,0,0,0,0,ordinary people robert redford the accidental death older son affluent family deeply strains relationships among bitter mother goodnatured father guiltridden younger son,0,0
4266,4266,61937,sleepless,baran bo odar,a cop connection criminal underworld scours nightclub search kidnapped son,95,2017,30000000,"Action, Crime, Thriller",1,0,0,1,0,0,0,0,0,1,0,0,0,0,0,0,1,0,0,0,0,0,sleepless baran bo odar a cop connection criminal underworld scours nightclub search kidnapped son,1,1
1163,1163,26955,weekend at bernies ii,robert klane,larry richard use voodoorevived corpse track hidden money clear names,97,1993,7000000,"Adventure, Comedy, Fantasy",1,0,0,0,0,0,1,1,0,0,0,0,1,0,0,0,0,0,0,0,0,0,weekend at bernies ii robert klane larry richard use voodoorevived corpse track hidden money clear names,0,0
2320,2320,38314,punchdrunk love,paul thomas anderson,a psychologically troubled novelty supplier nudged towards romance english woman extorted phonesex line run crooked mattress salesman purchasing stunning amounts pudding,95,2002,25000000,"Comedy, Drama, Romance",0,0,0,0,0,0,1,0,0,0,0,1,0,0,0,0,0,0,0,1,0,0,punchdrunk love paul thomas anderson a psychologically troubled novelty supplier nudged towards romance english woman extorted phonesex line run crooked mattress salesman purchasing stunning amounts pudding,1,0
1143,1143,26664,manhattan murder mystery,woody allen,a middleaged couple suspects foul play neighbors wife suddenly drops dead,104,1993,13500000,"Comedy, Mystery",0,0,0,0,1,0,1,0,0,0,0,0,0,0,0,0,0,0,0,0,0,0,manhattan murder mystery woody allen a middleaged couple suspects foul play neighbors wife suddenly drops dead,1,0
28,28,7560,the caine mutiny,edward dmytryk,when us naval captain shows signs mental instability jeopardizes ship first officer relieves command faces court martial mutiny,124,1954,2000000,"Drama, War",1,0,0,0,0,0,0,0,0,0,0,1,0,0,0,0,0,0,0,0,0,1,the caine mutiny edward dmytryk when us naval captain shows signs mental instability jeopardizes ship first officer relieves command faces court martial mutiny,1,1
685,685,23393,permanent record,marisa silver,when david sinclair popular talented high school student commits suicide best friend chris takes many responsibilities school production hms ,91,1988,8000000,"Drama, Music, Romance",0,0,0,0,0,0,0,0,0,0,0,1,0,0,0,0,0,1,0,1,0,0,permanent record marisa silver when david sinclair popular talented high school student commits suicide best friend chris takes many responsibilities school production hms ,1,0
3304,3304,49714,please give,nicole holofcener,in new york city husband wife butt heads granddaughters elderly woman lives apartment couple owns,87,2010,3000000,"Comedy, Drama",1,0,0,0,0,0,1,0,0,0,0,1,0,0,0,0,0,0,0,0,0,0,please give nicole holofcener in new york city husband wife butt heads granddaughters elderly woman lives apartment couple owns,0,0
4262,4262,68804,unforgettable,denise di novi,a woman sets make life living hell exhusbands new fiancée,100,2017,12000000,"Drama, Thriller",1,0,0,0,0,0,0,0,0,1,0,1,0,0,0,0,0,0,0,0,0,0,unforgettable denise di novi a woman sets make life living hell exhusbands new fiancée,0,0
2627,2627,42139,duma,carroll ballard,an orphaned cheetah becomes best friend pet young boy living south africa,100,2005,12000000,"Adventure, Drama, Family",0,0,0,0,0,0,0,0,0,0,0,1,1,0,0,0,0,0,1,0,0,0,duma carroll ballard an orphaned cheetah becomes best friend pet young boy living south africa,1,0
910,910,24597,kindergarten cop,ivan reitman,a tough cop must pose kindergarten teacher order locate dangerous criminals exwife may hold key putting behind bars,111,1990,15000000,"Comedy, Crime",1,0,0,0,0,0,1,0,0,0,0,0,0,0,0,0,1,0,0,0,0,0,kindergarten cop ivan reitman a tough cop must pose kindergarten teacher order locate dangerous criminals exwife may hold key putting behind bars,1,1
3183,3183,53352,april showers,andrew robinson,after school shooting leaves 14 people dead survivor sean ryan forced come terms loss,94,2009,1100000,"Crime, Drama",0,0,0,0,0,0,0,0,0,0,0,1,0,0,0,0,1,0,0,0,0,0,april showers andrew robinson after school shooting leaves 14 people dead survivor sean ryan forced come terms loss,1,0
2193,2193,36529,the pledge,sean penn,a retiring police detective pledges catch killer young child,124,2001,35000000,"Crime, Drama, Mystery",0,0,0,0,1,0,0,0,0,0,0,1,0,0,0,0,1,0,0,0,0,0,the pledge sean penn a retiring police detective pledges catch killer young child,1,0
3761,3761,60756,parker,taylor hackford,a thief unique code professional ethics doublecrossed crew left dead assuming new disguise forming unlikely alliance woman inside looks hijack score crews latest heist,118,2013,35000000,"Action, Crime, Thriller",1,0,0,1,0,0,0,0,0,1,0,0,0,0,0,0,1,0,0,0,0,0,parker taylor hackford a thief unique code professional ethics doublecrossed crew left dead assuming new disguise forming unlikely alliance woman inside looks hijack score crews latest heist,1,1
4294,4294,77776,a quiet place,john krasinski,in postapocalyptic world family forced live silence hiding monsters ultrasensitive hearing,90,2018,17000000,"Drama, Horror, Sci-Fi",1,0,0,0,0,1,0,0,0,0,0,1,0,1,0,0,0,0,0,0,0,0,a quiet place john krasinski in postapocalyptic world family forced live silence hiding monsters ultrasensitive hearing,1,1
1128,1128,25784,freejack,geoff murphy,bounty hunters future transport doomed race car driver new york city 2009 mind replaced dead billionaire,110,1992,30000000,"Action, Crime, Sci-Fi",0,0,0,1,0,1,0,0,0,0,0,0,0,0,0,0,1,0,0,0,0,0,freejack geoff murphy bounty hunters future transport doomed race car driver new york city 2009 mind replaced dead billionaire,1,0
1501,1501,29303,sgt bilko,jonathan lynn,sgt bilko wellliked conman charge army bases motor pool developing hover tank unofficially gambling etc one man hates bilko hes coming inspect base possible closure,93,1996,39000000,Comedy,0,0,0,0,0,0,1,0,0,0,0,0,0,0,0,0,0,0,0,0,0,0,sgt bilko jonathan lynn sgt bilko wellliked conman charge army bases motor pool developing hover tank unofficially gambling etc one man hates bilko hes coming inspect base possible closure,0,1
3187,3187,53612,sorority row,stewart hendler,a group sorority sisters try cover death housesister prank gone wrong stalked serial killer,101,2009,12500000,"Horror, Mystery",1,0,0,0,1,0,0,0,0,0,0,0,0,1,0,0,0,0,0,0,0,0,sorority row stewart hendler a group sorority sisters try cover death housesister prank gone wrong stalked serial killer,0,0
4215,4215,74077,justice,richard gabai,a us marshal seeking justice brothers murder defends small town corrupt mayor henchmen intents revive civil war,92,2017,1500000,Western,0,0,0,0,0,0,0,0,0,0,0,0,0,0,0,0,0,0,0,0,1,0,justice richard gabai a us marshal seeking justice brothers murder defends small town corrupt mayor henchmen intents revive civil war,1,0
1195,1195,26349,bopha,morgan freeman,in story black policeman south african apartheid danny glover plays cop believes hes trying help people even serving pawn racist ,120,1993,12000000,Drama,0,0,0,0,0,0,0,0,0,0,0,1,0,0,0,0,0,0,0,0,0,0,bopha morgan freeman in story black policeman south african apartheid danny glover plays cop believes hes trying help people even serving pawn racist ,0,1
3612,3612,58580,playback,michael a nickles,a cop investigates case missing local teen though discovers dark secret unleashed town evil spirit stop nothing find heir,98,2012,1600000,"Horror, Thriller",0,0,0,0,0,0,0,0,0,1,0,0,0,1,0,0,0,0,0,0,0,0,playback michael a nickles a cop investigates case missing local teen though discovers dark secret unleashed town evil spirit stop nothing find heir,1,0
2579,2579,44590,dreamer inspired by a true story,john gatins,cale crane catalyzes rescue rehabilitation sonador race horse broken leg,106,2005,32000000,"Drama, Family, Sport",1,0,0,0,0,0,0,0,1,0,0,1,0,0,0,0,0,0,1,0,0,0,dreamer inspired by a true story john gatins cale crane catalyzes rescue rehabilitation sonador race horse broken leg,1,1
2414,2414,40341,holes,andrew davis,a wrongfully convicted boy sent brutal desert detention camp joins job digging holes mysterious reason,117,2003,20000000,"Adventure, Comedy, Drama",1,0,0,0,0,0,1,0,0,0,0,1,1,0,0,0,0,0,0,0,0,0,holes andrew davis a wrongfully convicted boy sent brutal desert detention camp joins job digging holes mysterious reason,1,1
123,123,16640,the jezebels,jack hill,the leader inner city girl gang challenged new girl moves neighbourhood,91,1975,320000,"Action, Crime, Drama",0,0,0,1,0,0,0,0,0,0,0,1,0,0,0,0,1,0,0,0,0,0,the jezebels jack hill the leader inner city girl gang challenged new girl moves neighbourhood,1,0
3474,3474,58193,super 8,jj abrams,during summer 1979 group friends witness train crash investigate subsequent unexplained events small town,112,2011,50000000,"Mystery, Sci-Fi, Thriller",1,0,0,0,1,1,0,0,0,1,0,0,0,0,0,0,0,0,0,0,0,0,super 8 jj abrams during summer 1979 group friends witness train crash investigate subsequent unexplained events small town,1,1
2242,2242,42647,lanas rain,michael s ojeda,this powerful hardedged crime drama explores dark side american immigrant experience dares ask how far would go survive lanas chance escape ,107,2002,215000,Drama,0,0,0,0,0,0,0,0,0,0,0,1,0,0,0,0,0,0,0,0,0,0,lanas rain michael s ojeda this powerful hardedged crime drama explores dark side american immigrant experience dares ask how far would go survive lanas chance escape ,0,1
2300,2300,37572,panic room,david fincher,a divorced woman diabetic daughter take refuge newlypurchased houses safe room three men breakin searching missing fortune,112,2002,48000000,"Crime, Drama, Thriller",1,0,0,0,0,0,0,0,0,1,0,1,0,0,0,0,1,0,0,0,0,0,panic room david fincher a divorced woman diabetic daughter take refuge newlypurchased houses safe room three men breakin searching missing fortune,1,1
3310,3310,49887,how to train your dragon,dean deblois chris sanders,a hapless young viking aspires hunt dragons becomes unlikely friend young dragon himself learns may creatures assumed,98,2010,165000000,"Animation, Action, Adventure",1,1,0,1,0,0,0,0,0,0,0,0,1,0,0,0,0,0,0,0,0,0,how to train your dragon dean deblois chris sanders a hapless young viking aspires hunt dragons becomes unlikely friend young dragon himself learns may creatures assumed,1,1
4078,4078,62206,inside out,pete docter ronnie del carmen,after young riley uprooted midwest life moved san francisco emotions  joy fear anger disgust sadness  conflict best navigate new city house school,95,2015,175000000,"Animation, Adventure, Comedy",1,1,0,0,0,0,1,0,0,0,0,0,1,0,0,0,0,0,0,0,0,0,inside out pete docter ronnie del carmen after young riley uprooted midwest life moved san francisco emotions  joy fear anger disgust sadness  conflict best navigate new city house school,1,1
1995,1995,35812,loser,amy heckerling,a college student branded loser roommates booted dorm falls love coed eyes condescending professor,98,2000,20000000,"Comedy, Romance",0,0,0,0,0,0,1,0,0,0,0,0,0,0,0,0,0,0,0,1,0,0,loser amy heckerling a college student branded loser roommates booted dorm falls love coed eyes condescending professor,1,0
