,Unnamed: 0,Unnamed: 0.1,title,director,description,duration,year,budget,genre,profitable,is_Animation,is_Biography,is_Action,is_Mystery,is_Sci-Fi,is_Comedy,is_Fantasy,is_Sport,is_Thriller,is_Film-Noir,is_Drama,is_Adventure,is_Horror,is_Musical,is_History,is_Crime,is_Music,is_Family,is_Romance,is_Western,is_War,text,nb_prediction,correct
940,940,24557,home alone,chris columbus,an eightyearold troublemaker must protect house pair burglars accidentally left home alone family christmas vacation,103,1990,18000000,"Comedy, Family",1,0,0,0,0,0,1,0,0,0,0,0,0,0,0,0,0,0,1,0,0,0,home alone chris columbus an eightyearold troublemaker must protect house pair burglars accidentally left home alone family christmas vacation,1,1
1122,1122,25815,hellraiser iii hell on earth,anthony hickox,an investigative reporter must send newly unbound pinhead legions back hell,97,1992,5000000,Horror,1,0,0,0,0,0,0,0,0,0,0,0,0,1,0,0,0,0,0,0,0,0,hellraiser iii hell on earth anthony hickox an investigative reporter must send newly unbound pinhead legions back hell,1,1
187,187,17709,the brinks job,william friedkin,crime story based real armed robbery brinks building boston massachusetts january 17th 1950,104,1978,15500000,"Comedy, Crime, Drama",0,0,0,0,0,0,1,0,0,0,0,1,0,0,0,0,1,0,0,0,0,0,the brinks job william friedkin crime story based real armed robbery brinks building boston massachusetts january 17th 1950,0,1
4230,4230,72434,the star,timothy reckart,a small brave donkey animal friends become unsung heroes first christmas,86,2017,20000000,"Animation, Adventure, Comedy",1,1,0,0,0,0,1,0,0,0,0,0,1,0,0,0,0,0,0,0,0,0,the star timothy reckart a small brave donkey animal friends become unsung heroes first christmas,1,1
3165,3165,45376,gforce,hoyt yeatman,a specially trained squad guinea pigs dispatched stop diabolical billionaire taking world,88,2009,150000000,"Animation, Action, Adventure",1,1,0,1,0,0,0,0,0,0,0,0,1,0,0,0,0,0,0,0,0,0,gforce hoyt yeatman a specially trained squad guinea pigs dispatched stop diabolical billionaire taking world,1,1
1272,1272,27725,true lies,james cameron,a fearless globetrotting terroristbattling secret agent life turned upside discovers wife might affair used car salesman terrorists smuggle nuclear war heads united states,141,1994,115000000,"Action, Comedy, Thriller",1,0,0,1,0,0,1,0,0,1,0,0,0,0,0,0,0,0,0,0,0,0,true lies james cameron a fearless globetrotting terroristbattling secret agent life turned upside discovers wife might affair used car salesman terrorists smuggle nuclear war heads united states,1,1
389,389,20246,the house on sorority row,mark rosman,after seemingly innocent prank goes horribly wrong group sorority sisters stalked murdered one one sorority house throwing party celebrate graduation,91,1983,425000,"Horror, Mystery, Thriller",1,0,0,0,1,0,0,0,0,1,0,0,0,1,0,0,0,0,0,0,0,0,the house on sorority row mark rosman after seemingly innocent prank goes horribly wrong group sorority sisters stalked murdered one one sorority house throwing party celebrate graduation,1,1
2039,2039,32802,what lies beneath,robert zemeckis,the wife university research scientist believes lakeside vermont home haunted ghost  losing mind,130,2000,100000000,"Drama, Fantasy, Horror",1,0,0,0,0,0,0,1,0,0,0,1,0,1,0,0,0,0,0,0,0,0,what lies beneath robert zemeckis the wife university research scientist believes lakeside vermont home haunted ghost  losing mind,1,1
880,880,24663,millers crossing,joel coen ethan coen,tom regan advisor prohibitionera crime boss tries keep peace warring mobs gets caught divided loyalties,115,1990,14000000,"Crime, Drama, Thriller",0,0,0,0,0,0,0,0,0,1,0,1,0,0,0,0,1,0,0,0,0,0,millers crossing joel coen ethan coen tom regan advisor prohibitionera crime boss tries keep peace warring mobs gets caught divided loyalties,1,0
1670,1670,29761,flubber,les mayfield,an absentminded professor discovers flubber rubberlike superbouncy substance,93,1997,80000000,"Comedy, Family, Sci-Fi",1,0,0,0,0,1,1,0,0,0,0,0,0,0,0,0,0,0,1,0,0,0,flubber les mayfield an absentminded professor discovers flubber rubberlike superbouncy substance,0,0
1406,1406,27996,dangerous minds,john n smith,an exmarine turned teacher struggles connect students inner city school,99,1995,23000000,"Biography, Drama",1,0,1,0,0,0,0,0,0,0,0,1,0,0,0,0,0,0,0,0,0,0,dangerous minds john n smith an exmarine turned teacher struggles connect students inner city school,0,0
256,256,18750,the final countdown,don taylor,a modern aircraft carrier thrown back time 1941 near hawaii hours japanese attack pearl harbor,103,1980,12000000,"Action, Sci-Fi",1,0,0,1,0,1,0,0,0,0,0,0,0,0,0,0,0,0,0,0,0,0,the final countdown don taylor a modern aircraft carrier thrown back time 1941 near hawaii hours japanese attack pearl harbor,1,1
3682,3682,61424,battlefield america,chris stokes,a young businessman lands community service sentence falls group misfit kids need mentoring with help pro instructor works get kids ready big underground dance competition,106,2012,15000000,"Drama, Musical",0,0,0,0,0,0,0,0,0,0,0,1,0,0,1,0,0,1,0,0,0,0,battlefield america chris stokes a young businessman lands community service sentence falls group misfit kids need mentoring with help pro instructor works get kids ready big underground dance competition,1,0
3346,3346,49284,the town,ben affleck,as plans next job longtime thief tries balance feelings bank manager connected one earlier heists well fbi agent looking bring crew down,125,2010,37000000,"Crime, Drama, Thriller",1,0,0,0,0,0,0,0,0,1,0,1,0,0,0,0,1,0,0,0,0,0,the town ben affleck as plans next job longtime thief tries balance feelings bank manager connected one earlier heists well fbi agent looking bring crew down,1,1
6,6,3277,the wizard of oz,victor fleming george cukor,dorothy gale swept away farm kansas magical land oz tornado embarks quest new friends see wizard help return home kansas help friends well,102,1939,2777000,"Adventure, Family, Fantasy",1,0,0,0,0,0,0,1,0,0,0,0,1,0,0,0,0,0,1,0,0,0,the wizard of oz victor fleming george cukor dorothy gale swept away farm kansas magical land oz tornado embarks quest new friends see wizard help return home kansas help friends well,1,1
2735,2735,46751,old joy,kelly reichardt,two old pals reunite camping trip oregons cascade mountains,76,2006,300000,Drama,1,0,0,0,0,0,0,0,0,0,0,1,0,0,0,0,0,0,0,0,0,0,old joy kelly reichardt two old pals reunite camping trip oregons cascade mountains,1,1
3979,3979,61217,infinitely polar bear,maya forbes,a father struggling bipolar disorder tries win back wife attempting take full responsibility two young spirited daughters make overwhelming task easier,90,2014,6700000,"Comedy, Drama, Romance",0,0,0,0,0,0,1,0,0,0,0,1,0,0,0,0,0,0,0,1,0,0,infinitely polar bear maya forbes a father struggling bipolar disorder tries win back wife attempting take full responsibility two young spirited daughters make overwhelming task easier,1,0
1264,1264,28512,swimming with sharks,george huang,a young naive hollywood studio assistant finally turns tables incredibly abusive producer boss,93,1994,700000,"Comedy, Crime",0,0,0,0,0,0,1,0,0,0,0,0,0,0,0,0,1,0,0,0,0,0,swimming with sharks george huang a young naive hollywood studio assistant finally turns tables incredibly abusive producer boss,1,0
1162,1162,26957,whats eating gilbert grape,lasse hallström,after fathers death gilbert care mentallydisabled brother arnie morbidly obese mother this situation suddenly challenged though love unexpectedly walks life,118,1993,11000000,Drama,0,0,0,0,0,0,0,0,0,0,0,1,0,0,0,0,0,0,0,0,0,0,whats eating gilbert grape lasse hallström after fathers death gilbert care mentallydisabled brother arnie morbidly obese mother this situation suddenly challenged though love unexpectedly walks life,0,1
2453,2453,42533,sleepover,joe nussbaum,four best friends desperate improve social status enter allnight scavenger hunt popular clique school,89,2004,10000000,"Comedy, Family, Romance",0,0,0,0,0,0,1,0,0,0,0,0,0,0,0,0,0,0,1,1,0,0,sleepover joe nussbaum four best friends desperate improve social status enter allnight scavenger hunt popular clique school,1,0
79,79,14003,love story,arthur hiller,a boy girl different backgrounds fall love regardless upbringing  tragedy strikes,100,1970,2200000,"Drama, Romance",1,0,0,0,0,0,0,0,0,0,0,1,0,0,0,0,0,0,0,1,0,0,love story arthur hiller a boy girl different backgrounds fall love regardless upbringing  tragedy strikes,1,1
224,224,18883,melvin and howard,jonathan demme,the story hardluck,95,1980,7000000,"Comedy, Drama",0,0,0,0,0,0,1,0,0,0,0,1,0,0,0,0,0,0,0,0,0,0,melvin and howard jonathan demme the story hardluck,1,0
3376,3376,51318,the book of eli,albert hughes allen hughes,a postapocalyptic tale lone man fights way across america order protect sacred book holds secrets saving humankind,118,2010,80000000,"Action, Adventure, Drama",1,0,0,1,0,0,0,0,0,0,0,1,1,0,0,0,0,0,0,0,0,0,the book of eli albert hughes allen hughes a postapocalyptic tale lone man fights way across america order protect sacred book holds secrets saving humankind,1,1
613,613,23222,the house on carroll street,peter yates,in 1950s america fbi agent blacklist victim uncover plot smuggle nazi war criminals country,101,1987,14000000,Thriller,0,0,0,0,0,0,0,0,0,1,0,0,0,0,0,0,0,0,0,0,0,0,the house on carroll street peter yates in 1950s america fbi agent blacklist victim uncover plot smuggle nazi war criminals country,1,0
2937,2937,46633,national treasure book of secrets,jon turteltaub,benjamin gates must follow clue left john wilkes booths diary prove ancestors innocence assassination abraham lincoln,124,2007,130000000,"Action, Adventure, Mystery",1,0,0,1,1,0,0,0,0,0,0,0,1,0,0,0,0,0,0,0,0,0,national treasure book of secrets jon turteltaub benjamin gates must follow clue left john wilkes booths diary prove ancestors innocence assassination abraham lincoln,1,1
203,203,18581,the warriors,walter hill,in near future charismatic leader summons street gangs new york city bid take over when killed the warriors falsely blamed must fight way home every gang hunting down,92,1979,4000000,"Action, Crime, Thriller",1,0,0,1,0,0,0,0,0,1,0,0,0,0,0,0,1,0,0,0,0,0,the warriors walter hill in near future charismatic leader summons street gangs new york city bid take over when killed the warriors falsely blamed must fight way home every gang hunting down,0,0
4013,4013,70163,cop car,jon watts,a smalltown sheriff sets find two kids taken car joy ride,88,2015,800000,"Crime, Thriller",0,0,0,0,0,0,0,0,0,1,0,0,0,0,0,0,1,0,0,0,0,0,cop car jon watts a smalltown sheriff sets find two kids taken car joy ride,0,1
2429,2429,42213,madhouse,william butler,a young psychiatric intern unearths secrets mental health facility works,91,2004,3000000,"Horror, Thriller",1,0,0,0,0,0,0,0,0,1,0,0,0,1,0,0,0,0,0,0,0,0,madhouse william butler a young psychiatric intern unearths secrets mental health facility works,1,1
2018,2018,31722,the yards,james gray,leo released prison serving time car theft his plan go straight falls apart meets corrupt uncle job later old friend working there it culminates railroad yards,115,2000,24000000,"Crime, Drama, Romance",0,0,0,0,0,0,0,0,0,0,0,1,0,0,0,0,1,0,0,1,0,0,the yards james gray leo released prison serving time car theft his plan go straight falls apart meets corrupt uncle job later old friend working there it culminates railroad yards,0,1
1675,1675,29826,hercules,ron clements john musker,the son zeus hera stripped immortality infant must become true hero order reclaim it,93,1997,85000000,"Animation, Adventure, Comedy",1,1,0,0,0,0,1,0,0,0,0,0,1,0,0,0,0,0,0,0,0,0,hercules ron clements john musker the son zeus hera stripped immortality infant must become true hero order reclaim it,1,1
19,19,6900,the greatest show on earth,cecil b demille,the dramatic lives trapeze artists clown elephant trainer told background circus spectacle,152,1952,4000000,"Drama, Family, Romance",1,0,0,0,0,0,0,0,0,0,0,1,0,0,0,0,0,0,1,1,0,0,the greatest show on earth cecil b demille the dramatic lives trapeze artists clown elephant trainer told background circus spectacle,1,1
2098,2098,38085,brigham city,richard dutcher,the sheriff small utah community searches serial killer,119,2001,1000000,"Crime, Drama, Mystery",0,0,0,0,1,0,0,0,0,0,0,1,0,0,0,0,1,0,0,0,0,0,brigham city richard dutcher the sheriff small utah community searches serial killer,1,0
3974,3974,67440,starcrossed,chase mohseni,a luck writer encounters mysterious woman course one memorable night rewrites future,78,2014,750000,"Drama, Romance, Thriller",0,0,0,0,0,0,0,0,0,1,0,1,0,0,0,0,0,0,0,1,0,0,starcrossed chase mohseni a luck writer encounters mysterious woman course one memorable night rewrites future,0,1
2625,2625,42762,bewitched,nora ephron,thinking overshadow unknown actress part egocentric actor unknowingly gets witch cast upcoming television remake classic sitcom,102,2005,85000000,"Comedy, Fantasy, Romance",1,0,0,0,0,0,1,1,0,0,0,0,0,0,0,0,0,0,0,1,0,0,bewitched nora ephron thinking overshadow unknown actress part egocentric actor unknowingly gets witch cast upcoming television remake classic sitcom,1,1
1533,1533,28638,alaska,fraser c heston,while searching missing father mountains alaska two siblings come across baby polar bear run pair poachers,109,1996,23000000,"Adventure, Family",0,0,0,0,0,0,0,0,0,0,0,0,1,0,0,0,0,0,1,0,0,0,alaska fraser c heston while searching missing father mountains alaska two siblings come across baby polar bear run pair poachers,1,0
4216,4216,71896,the ballad of lefty brown,jared moshe,a thrilling actionpacked western the ballad lefty brown story loyalty friendship relentless pursuit justice,111,2017,8000000,"Action, Drama, Western",0,0,0,1,0,0,0,0,0,0,0,1,0,0,0,0,0,0,0,0,1,0,the ballad of lefty brown jared moshe a thrilling actionpacked western the ballad lefty brown story loyalty friendship relentless pursuit justice,1,0
2582,2582,45484,dirty,chris fisher,two gangbangersturnedcops try cover scandal within lapd,97,2005,3000000,"Crime, Drama, Thriller",0,0,0,0,0,0,0,0,0,1,0,1,0,0,0,0,1,0,0,0,0,0,dirty chris fisher two gangbangersturnedcops try cover scandal within lapd,1,0
3759,3759,64299,runner runner,brad furman,when poor college student cracks online poker game goes bust arranges facetoface man thinks cheated him sly offshore entrepreneur,88,2013,30000000,"Crime, Thriller",1,0,0,0,0,0,0,0,0,1,0,0,0,0,0,0,1,0,0,0,0,0,runner runner brad furman when poor college student cracks online poker game goes bust arranges facetoface man thinks cheated him sly offshore entrepreneur,1,1
3764,3764,61210,labor day,jason reitman,depressed single mom adele son henry offer wounded fearsome man ride as police search town escaped convict mother son gradually learn true story options become increasingly limited,111,2013,18000000,"Drama, Romance",1,0,0,0,0,0,0,0,0,0,0,1,0,0,0,0,0,0,0,1,0,0,labor day jason reitman depressed single mom adele son henry offer wounded fearsome man ride as police search town escaped convict mother son gradually learn true story options become increasingly limited,1,1
2301,2301,38520,below,david twohy,strange happenings occur ww ii submarine,105,2002,40000000,"Action, Horror, Mystery",0,0,0,1,1,0,0,0,0,0,0,0,0,1,0,0,0,0,0,0,0,0,below david twohy strange happenings occur ww ii submarine,1,0
3042,3042,50446,fireflies in the garden,dennis lee,the taylor family devastated accident takes place day matriarch due graduate college  decades leaving raise children,120,2008,8000000,Drama,0,0,0,0,0,0,0,0,0,0,0,1,0,0,0,0,0,0,0,0,0,0,fireflies in the garden dennis lee the taylor family devastated accident takes place day matriarch due graduate college  decades leaving raise children,1,0
2529,2529,41623,the spongebob squarepants movie,stephen hillenburg mark osborne,spongebob squarepants takes leave town bikini bottom order track king neptunes stolen crown,87,2004,30000000,"Animation, Adventure, Comedy",1,1,0,0,0,0,1,0,0,0,0,0,1,0,0,0,0,0,0,0,0,0,the spongebob squarepants movie stephen hillenburg mark osborne spongebob squarepants takes leave town bikini bottom order track king neptunes stolen crown,1,1
2624,2624,41173,man of the house,stephen herek,a texas ranger must protect group cheerleaders witnessed murder,100,2005,40000000,"Comedy, Crime",0,0,0,0,0,0,1,0,0,0,0,0,0,0,0,0,1,0,0,0,0,0,man of the house stephen herek a texas ranger must protect group cheerleaders witnessed murder,1,0
3466,3466,57195,higher ground,vera farmiga,a chronicle one womans lifelong struggle faith,109,2011,2000000,Drama,0,0,0,0,0,0,0,0,0,0,0,1,0,0,0,0,0,0,0,0,0,0,higher ground vera farmiga a chronicle one womans lifelong struggle faith,1,0
1814,1814,32074,the rage carrie 2,katt shea robert mandel,a horrible massacre strikes outcast teenage girl taunted group high school jocks unaware cutthroat telekinetic powers,104,1999,21000000,"Horror, Sci-Fi, Thriller",0,0,0,0,0,1,0,0,0,1,0,0,0,1,0,0,0,0,0,0,0,0,the rage carrie 2 katt shea robert mandel a horrible massacre strikes outcast teenage girl taunted group high school jocks unaware cutthroat telekinetic powers,1,0
2229,2229,39268,the powerpuff girls movie,craig mccracken,the movie shows origin powerpuff girls cartoon series it explains born dedicated lives fighting crime forces evil,73,2002,11000000,"Animation, Action, Adventure",1,1,0,1,0,0,0,0,0,0,0,0,1,0,0,0,0,0,0,0,0,0,the powerpuff girls movie craig mccracken the movie shows origin powerpuff girls cartoon series it explains born dedicated lives fighting crime forces evil,1,1
3964,3964,60552,the amazing spiderman 2,marc webb,when new york put siege oscorp spiderman save city swore protect well loved ones,142,2014,200000000,"Action, Adventure, Sci-Fi",1,0,0,1,0,1,0,0,0,0,0,0,1,0,0,0,0,0,0,0,0,0,the amazing spiderman 2 marc webb when new york put siege oscorp spiderman save city swore protect well loved ones,1,1
2073,2073,36701,the affair of the necklace,charles shyer,in prerevolutionary france young aristocratic woman left penniless political unrest country must avenge familys fall grace scheming steal priceless necklace,118,2001,30000000,"Drama, History, Romance",0,0,0,0,0,0,0,0,0,0,0,1,0,0,0,1,0,0,0,1,0,0,the affair of the necklace charles shyer in prerevolutionary france young aristocratic woman left penniless political unrest country must avenge familys fall grace scheming steal priceless necklace,1,0
4104,4104,68604,allegiant,robert schwentke,after earthshattering revelations insurgent tris must escape four beyond wall encircles chicago finally discover shocking truth world around them,120,2016,110000000,"Action, Adventure, Mystery",1,0,0,1,1,0,0,0,0,0,0,0,1,0,0,0,0,0,0,0,0,0,allegiant robert schwentke after earthshattering revelations insurgent tris must escape four beyond wall encircles chicago finally discover shocking truth world around them,1,1
3093,3093,48256,tennessee,aaron woodley,the story three people strive realize dreams brothers carter ellis set road trip childhood home desperate search estranged father may hold key future,99,2008,4000000,"Adventure, Comedy, Drama",0,0,0,0,0,0,1,0,0,0,0,1,1,0,0,0,0,0,0,0,0,0,tennessee aaron woodley the story three people strive realize dreams brothers carter ellis set road trip childhood home desperate search estranged father may hold key future,1,0
2586,2586,44878,the adventures of sharkboy and lavagirl 3d,robert rodriguez,a young boy recruited imaginary friends sharkboy lavagirl help save planet,93,2005,50000000,"Action, Adventure, Comedy",1,0,0,1,0,0,1,0,0,0,0,0,1,0,0,0,0,0,0,0,0,0,the adventures of sharkboy and lavagirl 3d robert rodriguez a young boy recruited imaginary friends sharkboy lavagirl help save planet,1,1
2024,2024,30565,titan ae,don bluth gary goldman,a young man learns find hidden earth ship enemy alien species order secure survival humanity,94,2000,75000000,"Animation, Action, Adventure",0,1,0,1,0,0,0,0,0,0,0,0,1,0,0,0,0,0,0,0,0,0,titan ae don bluth gary goldman a young man learns find hidden earth ship enemy alien species order secure survival humanity,1,0
3178,3178,53507,the greatest,shana feste,a drama centered around troubled teenage girl family trying get loss son,99,2009,6000000,"Drama, Romance",0,0,0,0,0,0,0,0,0,0,0,1,0,0,0,0,0,0,0,1,0,0,the greatest shana feste a drama centered around troubled teenage girl family trying get loss son,1,0
464,464,21372,missing in action 2 the beginning,lance hool,prequel first missing in action set early 1980s shows capture colonel braddock vietnam war 1970s captivity american pows brutal prison camp plans escape,100,1985,2410000,"Action, Drama, Thriller",1,0,0,1,0,0,0,0,0,1,0,1,0,0,0,0,0,0,0,0,0,0,missing in action 2 the beginning lance hool prequel first missing in action set early 1980s shows capture colonel braddock vietnam war 1970s captivity american pows brutal prison camp plans escape,1,1
772,772,23132,elvira mistress of the dark,james signorelli,upon arriving small town inherited rundown mansion famous horror hostess battles evil uncle townspeople want burned stake,96,1988,7500000,"Comedy, Horror",0,0,0,0,0,0,1,0,0,0,0,0,0,1,0,0,0,0,0,0,0,0,elvira mistress of the dark james signorelli upon arriving small town inherited rundown mansion famous horror hostess battles evil uncle townspeople want burned stake,1,0
1513,1513,28780,courage under fire,edward zwick,a us army officer despondent deadly mistake made investigates female chopper commanders worthiness medal honor,116,1996,46000000,"Action, Drama, Mystery",1,0,0,1,1,0,0,0,0,0,0,1,0,0,0,0,0,0,0,0,0,0,courage under fire edward zwick a us army officer despondent deadly mistake made investigates female chopper commanders worthiness medal honor,1,1
1854,1854,34267,the blair witch project,daniel myrick eduardo sánchez,three film students vanish traveling maryland forest film documentary local blair witch legend leaving footage behind,81,1999,60000,"Horror, Mystery",1,0,0,0,1,0,0,0,0,0,0,0,0,1,0,0,0,0,0,0,0,0,the blair witch project daniel myrick eduardo sánchez three film students vanish traveling maryland forest film documentary local blair witch legend leaving footage behind,0,0
2742,2742,46873,for your consideration,christopher guest,three actors learn respective performances film home purim drama set mid1940s american south generating awardseason buzz,86,2006,12000000,Comedy,0,0,0,0,0,0,1,0,0,0,0,0,0,0,0,0,0,0,0,0,0,0,for your consideration christopher guest three actors learn respective performances film home purim drama set mid1940s american south generating awardseason buzz,0,1
231,231,18948,raging bull,martin scorsese,the life boxer,129,1980,18000000,"Biography, Drama, Sport",1,0,1,0,0,0,0,0,1,0,0,1,0,0,0,0,0,0,0,0,0,0,raging bull martin scorsese the life boxer,1,1
3879,3879,61741,old fashioned,rik swartzwelder,a reformed frat boy opens antique store college town falls freespirited girl moves apartment shop in time unlikely pair fall traditional courtship,115,2014,600000,"Drama, Romance",1,0,0,0,0,0,0,0,0,0,0,1,0,0,0,0,0,0,0,1,0,0,old fashioned rik swartzwelder a reformed frat boy opens antique store college town falls freespirited girl moves apartment shop in time unlikely pair fall traditional courtship,1,1
796,796,24098,relentless,william lustig,two los angeles police detectives cynical veteran malloy cocky rookie dietz hunt serial killer excop named taylor randomly chooses victims phone directory,92,1989,4000000,"Crime, Thriller",1,0,0,0,0,0,0,0,0,1,0,0,0,0,0,0,1,0,0,0,0,0,relentless william lustig two los angeles police detectives cynical veteran malloy cocky rookie dietz hunt serial killer excop named taylor randomly chooses victims phone directory,0,0
2279,2279,37956,the rookie,john lee hancock,a texas baseball coach makes major league agreeing try high school team made playoffs,127,2002,22000000,"Drama, Family, Sport",1,0,0,0,0,0,0,0,1,0,0,1,0,0,0,0,0,0,1,0,0,0,the rookie john lee hancock a texas baseball coach makes major league agreeing try high school team made playoffs,1,1
3837,3837,58301,grudge match,peter segal,a pair aging boxing rivals coaxed retirement fight one final bout thirty years last match,113,2013,40000000,"Comedy, Drama, Sport",1,0,0,0,0,0,1,0,1,0,0,1,0,0,0,0,0,0,0,0,0,0,grudge match peter segal a pair aging boxing rivals coaxed retirement fight one final bout thirty years last match,1,1
1438,1438,28098,friday,f gary gray,two homies smokey craig smoke dope dealers weed try figure way get 200 owe dealer 10 pm night,91,1995,3500000,"Comedy, Drama",1,0,0,0,0,0,1,0,0,0,0,1,0,0,0,0,0,0,0,0,0,0,friday f gary gray two homies smokey craig smoke dope dealers weed try figure way get 200 owe dealer 10 pm night,1,1
119,119,15835,blazing saddles,mel brooks,in order ruin western town corrupt politician appoints black sheriff promptly becomes formidable adversary,93,1974,2600000,"Comedy, Western",1,0,0,0,0,0,1,0,0,0,0,0,0,0,0,0,0,0,0,0,1,0,blazing saddles mel brooks in order ruin western town corrupt politician appoints black sheriff promptly becomes formidable adversary,1,1
1380,1380,28549,twelve monkeys,terry gilliam,in future world devastated disease convict sent back time gather information manmade virus wiped human population planet,129,1995,29000001,"Mystery, Sci-Fi, Thriller",1,0,0,0,1,1,0,0,0,1,0,0,0,0,0,0,0,0,0,0,0,0,twelve monkeys terry gilliam in future world devastated disease convict sent back time gather information manmade virus wiped human population planet,1,1
3287,3287,48372,the wolfman,joe johnston,upon return ancestral homeland american man bitten subsequently cursed by werewolf,103,2010,150000000,"Drama, Fantasy, Horror",0,0,0,0,0,0,0,1,0,0,0,1,0,1,0,0,0,0,0,0,0,0,the wolfman joe johnston upon return ancestral homeland american man bitten subsequently cursed by werewolf,1,0
4205,4205,61252,rules dont apply,warren beatty,the unconventional love story aspiring actress ambitious driver eccentric boss legendary billionaire,127,2016,25000000,"Comedy, Drama, Romance",0,0,0,0,0,0,1,0,0,0,0,1,0,0,0,0,0,0,0,1,0,0,rules dont apply warren beatty the unconventional love story aspiring actress ambitious driver eccentric boss legendary billionaire,0,1
