,Unnamed: 0,Unnamed: 0.1,title,director,description,duration,year,budget,genre,profitable,is_Animation,is_Biography,is_Action,is_Mystery,is_Sci-Fi,is_Comedy,is_Fantasy,is_Sport,is_Thriller,is_Film-Noir,is_Drama,is_Adventure,is_Horror,is_Musical,is_History,is_Crime,is_Music,is_Family,is_Romance,is_Western,is_War,text,nb_prediction,correct
4116,4116,70118,the nice guys,shane black,in 1970s los angeles mismatched pair private eyes investigate missing girl mysterious death porn star,116,2016,50000000,"Action, Comedy, Crime",1,0,0,1,0,0,1,0,0,0,0,0,0,0,0,0,1,0,0,0,0,0,the nice guys shane black in 1970s los angeles mismatched pair private eyes investigate missing girl mysterious death porn star,1,1
2410,2410,40433,runaway jury,gary fleder,a juror inside woman outside manipulate court trial involving major gun manufacturer,127,2003,60000000,"Crime, Drama, Thriller",1,0,0,0,0,0,0,0,0,1,0,1,0,0,0,0,1,0,0,0,0,0,runaway jury gary fleder a juror inside woman outside manipulate court trial involving major gun manufacturer,0,0
2614,2614,44597,junebug,phil morrison,a dealer outsider art travels chicago north carolina meet new inlaws challenging equilibrium middle class southern home,106,2005,1000000,"Comedy, Drama",1,0,0,0,0,0,1,0,0,0,0,1,0,0,0,0,0,0,0,0,0,0,junebug phil morrison a dealer outsider art travels chicago north carolina meet new inlaws challenging equilibrium middle class southern home,1,1
1635,1635,30198,soul food,george tillman jr,one person keep family together and one person gone family torn apart,115,1997,7500000,"Comedy, Drama",1,0,0,0,0,0,1,0,0,0,0,1,0,0,0,0,0,0,0,0,0,0,soul food george tillman jr one person keep family together and one person gone family torn apart,1,1
3968,3968,58153,million dollar arm,craig gillespie,a sports agent stages unconventional recruitment strategy get talented indian cricket players play major league baseball,124,2014,25000000,"Biography, Drama, Sport",1,0,1,0,0,0,0,0,1,0,0,1,0,0,0,0,0,0,0,0,0,0,million dollar arm craig gillespie a sports agent stages unconventional recruitment strategy get talented indian cricket players play major league baseball,0,0
2818,2818,42156,scary movie 4,david zucker,cindy finds house lives haunted little boy goes quest find killed why also alien tripods invading world uncover secret order stop them,83,2006,45000000,Comedy,1,0,0,0,0,0,1,0,0,0,0,0,0,0,0,0,0,0,0,0,0,0,scary movie 4 david zucker cindy finds house lives haunted little boy goes quest find killed why also alien tripods invading world uncover secret order stop them,1,1
2975,2975,47135,the brave one,neil jordan,struggling recover emotionally brutal assault killed fiancé left coma radio personality begins quest vengeance perpetrators leaves bloody trail across new york city,122,2007,70000000,"Action, Crime, Drama",0,0,0,1,0,0,0,0,0,0,0,1,0,0,0,0,1,0,0,0,0,0,the brave one neil jordan struggling recover emotionally brutal assault killed fiancé left coma radio personality begins quest vengeance perpetrators leaves bloody trail across new york city,1,0
3285,3285,55197,main street,john doyle,several residents small southern city whose lives changed arrival stranger controversial plan save decaying hometown in midst todays ,92,2010,10000000,Drama,0,0,0,0,0,0,0,0,0,0,0,1,0,0,0,0,0,0,0,0,0,0,main street john doyle several residents small southern city whose lives changed arrival stranger controversial plan save decaying hometown in midst todays ,1,0
2479,2479,42421,soul plane,jessy terrero,things get raucously funny aboard maiden flight blackowned airline thanks lastminute passenger additions,86,2004,16000000,Comedy,0,0,0,0,0,0,1,0,0,0,0,0,0,0,0,0,0,0,0,0,0,0,soul plane jessy terrero things get raucously funny aboard maiden flight blackowned airline thanks lastminute passenger additions,1,0
2136,2136,37583,lovely  amazing,nicole holofcener,selfesteem insecurity heart comedy relationship mother three confused daughters,91,2001,250000,"Comedy, Drama, Romance",1,0,0,0,0,0,1,0,0,0,0,1,0,0,0,0,0,0,0,1,0,0,lovely  amazing nicole holofcener selfesteem insecurity heart comedy relationship mother three confused daughters,1,1
3898,3898,63787,wild,jeanmarc vallée,a chronicle one womans one thousand one hundred mile solo hike undertaken way recover recent personal tragedy,115,2014,15000000,"Biography, Drama",1,0,1,0,0,0,0,0,0,0,0,1,0,0,0,0,0,0,0,0,0,0,wild jeanmarc vallée a chronicle one womans one thousand one hundred mile solo hike undertaken way recover recent personal tragedy,1,1
3567,3567,53955,the cabin in the woods,drew goddard,five friends go break remote cabin get bargained for discovering truth behind cabin woods,95,2011,30000000,Horror,1,0,0,0,0,0,0,0,0,0,0,0,0,1,0,0,0,0,0,0,0,0,the cabin in the woods drew goddard five friends go break remote cabin get bargained for discovering truth behind cabin woods,1,1
3831,3831,53828,this is the end,evan goldberg seth rogen,6 los angeles celebrities stuck james francos house series devastating events destroyed city inside group face apocalypse themselves,107,2013,32000000,Comedy,1,0,0,0,0,0,1,0,0,0,0,0,0,0,0,0,0,0,0,0,0,0,this is the end evan goldberg seth rogen 6 los angeles celebrities stuck james francos house series devastating events destroyed city inside group face apocalypse themselves,1,1
2961,2961,44821,surfs up,ash brannon chris buck,a behindthescenes look annual penguin world surfing championship newest participant upandcomer cody maverick,85,2007,100000000,"Animation, Comedy, Family",1,1,0,0,0,0,1,0,0,0,0,0,0,0,0,0,0,0,1,0,0,0,surfs up ash brannon chris buck a behindthescenes look annual penguin world surfing championship newest participant upandcomer cody maverick,1,1
1584,1584,29904,kiss the girls,gary fleder,police hunting serial kidnapper helped victim manages escape first time,115,1997,27000000,"Crime, Drama, Mystery",1,0,0,0,1,0,0,0,0,0,0,1,0,0,0,0,1,0,0,0,0,0,kiss the girls gary fleder police hunting serial kidnapper helped victim manages escape first time,0,0
4322,4322,78578,destroyer,karyn kusama,a police detective reconnects people undercover assignment distant past order make peace,121,2018,9000000,"Action, Crime, Drama",0,0,0,1,0,0,0,0,0,0,0,1,0,0,0,0,1,0,0,0,0,0,destroyer karyn kusama a police detective reconnects people undercover assignment distant past order make peace,1,0
3252,3252,49339,the collector,marcus dunstan,desperate repay debt exwife excon plots heist new employers country home unaware second criminal also targeted property rigged series deadly traps,90,2009,6000000,"Horror, Thriller",1,0,0,0,0,0,0,0,0,1,0,0,0,1,0,0,0,0,0,0,0,0,the collector marcus dunstan desperate repay debt exwife excon plots heist new employers country home unaware second criminal also targeted property rigged series deadly traps,1,1
3321,3321,54415,the last song,julie anne robinson,a rebellious girl sent southern beach town summer stay father through mutual love music estranged duo learn reconnect,107,2010,20000000,"Drama, Music, Romance",1,0,0,0,0,0,0,0,0,0,0,1,0,0,0,0,0,1,0,1,0,0,the last song julie anne robinson a rebellious girl sent southern beach town summer stay father through mutual love music estranged duo learn reconnect,1,1
960,960,25376,out for justice,john flynn,the gruesome murder brooklyn detective turn case personal vendetta deceaseds best friend fellow officer unleash allout attack psychotic mafia enforcers brutal gang,91,1991,14000000,"Action, Crime, Drama",1,0,0,1,0,0,0,0,0,0,0,1,0,0,0,0,1,0,0,0,0,0,out for justice john flynn the gruesome murder brooklyn detective turn case personal vendetta deceaseds best friend fellow officer unleash allout attack psychotic mafia enforcers brutal gang,1,1
2013,2013,35142,you can count on me,kenneth lonergan,a single mothers life thrown turmoil struggling rarely seen younger brother returns town,111,2000,1200000,Drama,1,0,0,0,0,0,0,0,0,0,0,1,0,0,0,0,0,0,0,0,0,0,you can count on me kenneth lonergan a single mothers life thrown turmoil struggling rarely seen younger brother returns town,1,1
3858,3858,62692,horrible bosses 2,sean anders,dale kurt nick decide start business things go planned slick investor prompting trio pull harebrained misguided kidnapping scheme,108,2014,42000000,"Comedy, Crime",1,0,0,0,0,0,1,0,0,0,0,0,0,0,0,0,1,0,0,0,0,0,horrible bosses 2 sean anders dale kurt nick decide start business things go planned slick investor prompting trio pull harebrained misguided kidnapping scheme,1,1
2991,2991,45356,next,lee tamahori,a las vegas magician see future pursued fbi agents seeking use abilities prevent nuclear terrorist attack,96,2007,70000000,"Action, Sci-Fi, Thriller",1,0,0,1,0,1,0,0,0,1,0,0,0,0,0,0,0,0,0,0,0,0,next lee tamahori a las vegas magician see future pursued fbi agents seeking use abilities prevent nuclear terrorist attack,1,1
1141,1141,26727,nowhere to run,robert harmon,escaped convict sam gillen single handedly takes ruthless developers determined evict clydie  widow two young children nobody knows sam is,94,1993,15000000,"Action, Drama, Romance",1,0,0,1,0,0,0,0,0,0,0,1,0,0,0,0,0,0,0,1,0,0,nowhere to run robert harmon escaped convict sam gillen single handedly takes ruthless developers determined evict clydie  widow two young children nobody knows sam is,0,0
1080,1080,26116,single white female,barbet schroeder,a woman advertising new roommate finds something strange going tenant decides move in,107,1992,16000000,"Drama, Thriller",1,0,0,0,0,0,0,0,0,1,0,1,0,0,0,0,0,0,0,0,0,0,single white female barbet schroeder a woman advertising new roommate finds something strange going tenant decides move in,1,1
107,107,15289,american graffiti,george lucas,a couple high school grads spend one final night cruising strip buddies go college,110,1973,777000,"Comedy, Drama",1,0,0,0,0,0,1,0,0,0,0,1,0,0,0,0,0,0,0,0,0,0,american graffiti george lucas a couple high school grads spend one final night cruising strip buddies go college,1,1
3554,3554,46897,tower heist,brett ratner,when group hardworking guys find theyve fallen victim wealthy employers ponzi scheme conspire rob highrise residence,104,2011,75000000,"Action, Comedy, Crime",1,0,0,1,0,0,1,0,0,0,0,0,0,0,0,0,1,0,0,0,0,0,tower heist brett ratner when group hardworking guys find theyve fallen victim wealthy employers ponzi scheme conspire rob highrise residence,1,1
1453,1453,29220,the people vs larry flynt,milos forman,the story controversial pornography publisher became defender free speech,129,1996,36000000,"Biography, Drama",0,0,1,0,0,0,0,0,0,0,0,1,0,0,0,0,0,0,0,0,0,0,the people vs larry flynt milos forman the story controversial pornography publisher became defender free speech,0,1
3552,3552,50747,the green hornet,michel gondry,following death father britt reid heir fathers large company teams late dads assistant kato become masked crime fighting team,119,2011,120000000,"Action, Comedy, Crime",1,0,0,1,0,0,1,0,0,0,0,0,0,0,0,0,1,0,0,0,0,0,the green hornet michel gondry following death father britt reid heir fathers large company teams late dads assistant kato become masked crime fighting team,0,0
1105,1105,25198,high strung,roger nygard,thane furrows extremely cynical unintentionally hilarious childrens book writer wakes one morning and since pretty much everyone everything annoys him begins another day,93,1992,300000,Comedy,0,0,0,0,0,0,1,0,0,0,0,0,0,0,0,0,0,0,0,0,0,0,high strung roger nygard thane furrows extremely cynical unintentionally hilarious childrens book writer wakes one morning and since pretty much everyone everything annoys him begins another day,1,0
1385,1385,28513,tales from the crypt demon knight,ernest r dickerson,a man run hunted demon known collector,92,1995,13000000,"Action, Fantasy, Horror",1,0,0,1,0,0,0,1,0,0,0,0,0,1,0,0,0,0,0,0,0,0,tales from the crypt demon knight ernest r dickerson a man run hunted demon known collector,1,1
2352,2352,42120,assisted living,elliot greenebaum,assisted living chronicles day life todd janitor assisted living shot staged real nursing home gains,78,2003,500000,"Comedy, Drama",0,0,0,0,0,0,1,0,0,0,0,1,0,0,0,0,0,0,0,0,0,0,assisted living elliot greenebaum assisted living chronicles day life todd janitor assisted living shot staged real nursing home gains,1,0
3472,3472,56314,cedar rapids,miguel arteta,tim lippe idea hes hes sent cedar rapids iowa represent company annual insurance convention soon finds guidance three convention veterans,87,2011,10000000,Comedy,0,0,0,0,0,0,1,0,0,0,0,0,0,0,0,0,0,0,0,0,0,0,cedar rapids miguel arteta tim lippe idea hes hes sent cedar rapids iowa represent company annual insurance convention soon finds guidance three convention veterans,1,0
2240,2240,40264,the dogwalker,jacques thelemaque,the la dog walking scene provides colorful backdrop story ellie moore damaged goods run latest abusive boyfriend verge transformation shes ,99,2002,425000,Drama,0,0,0,0,0,0,0,0,0,0,0,1,0,0,0,0,0,0,0,0,0,0,the dogwalker jacques thelemaque the la dog walking scene provides colorful backdrop story ellie moore damaged goods run latest abusive boyfriend verge transformation shes ,1,0
3232,3232,52890,city island,raymond de felitta,the rizzos family share habits aspirations careers one another find delicate web lies disturbed arrival young excon strait brought ,104,2009,6000000,"Comedy, Drama",1,0,0,0,0,0,1,0,0,0,0,1,0,0,0,0,0,0,0,0,0,0,city island raymond de felitta the rizzos family share habits aspirations careers one another find delicate web lies disturbed arrival young excon strait brought ,1,1
2161,2161,35601,pearl harbor,michael bay,a tale war romance mixed history the story follows two lifelong friends beautiful nurse caught horror infamous sunday morning 1941,183,2001,140000000,"Action, Drama, History",1,0,0,1,0,0,0,0,0,0,0,1,0,0,0,1,0,0,0,0,0,0,pearl harbor michael bay a tale war romance mixed history the story follows two lifelong friends beautiful nurse caught horror infamous sunday morning 1941,1,1
4109,4109,69125,nerve,henry joost ariel schulman,a high school senior finds immersed online game truth dare every move starts become manipulated anonymous community watchers,96,2016,19000000,"Adventure, Crime, Drama",1,0,0,0,0,0,0,0,0,0,0,1,1,0,0,0,1,0,0,0,0,0,nerve henry joost ariel schulman a high school senior finds immersed online game truth dare every move starts become manipulated anonymous community watchers,1,1
4065,4065,57694,beyond the farthest star,andrew librizzi,a twist fate brings national spotlight forgotten texas town famous preacher opportunity regain former glory seize one last chance restore ,119,2015,500000,"Drama, Family, Thriller",0,0,0,0,0,0,0,0,0,1,0,1,0,0,0,0,0,0,1,0,0,0,beyond the farthest star andrew librizzi a twist fate brings national spotlight forgotten texas town famous preacher opportunity regain former glory seize one last chance restore ,1,0
3716,3716,64565,enough said,nicole holofcener,a divorced woman decides pursue man interested learns hes new friends exhusband,93,2013,8000000,"Comedy, Drama, Romance",1,0,0,0,0,0,1,0,0,0,0,1,0,0,0,0,0,0,0,1,0,0,enough said nicole holofcener a divorced woman decides pursue man interested learns hes new friends exhusband,1,1
3692,3692,60945,knife fight,bill guttentag,a political strategist juggling three clients questions whether take high road ugly side work begins haunt him,100,2012,7000000,Drama,0,0,0,0,0,0,0,0,0,0,0,1,0,0,0,0,0,0,0,0,0,0,knife fight bill guttentag a political strategist juggling three clients questions whether take high road ugly side work begins haunt him,1,0
3846,3846,58884,21  over,jon lucas scott moore,the night big medical school interview promising student celebrates 21st birthday two best friends,93,2013,13000000,Comedy,1,0,0,0,0,0,1,0,0,0,0,0,0,0,0,0,0,0,0,0,0,0,21  over jon lucas scott moore the night big medical school interview promising student celebrates 21st birthday two best friends,1,1
1683,1683,28769,commandments,daniel taplitz,seth warner reached end rope ever since wife died two years earlier world turmoil he despondent career fallen apart even house ,88,1997,6000000,"Comedy, Drama, Romance",0,0,0,0,0,0,1,0,0,0,0,1,0,0,0,0,0,0,0,1,0,0,commandments daniel taplitz seth warner reached end rope ever since wife died two years earlier world turmoil he despondent career fallen apart even house ,1,0
4323,4323,76892,assassination nation,sam levinson,after malicious data hack exposes secrets perpetually american town salem chaos descents four girls must fight survive coping hack themselves,108,2018,7000000,"Action, Comedy, Crime",0,0,0,1,0,0,1,0,0,0,0,0,0,0,0,0,1,0,0,0,0,0,assassination nation sam levinson after malicious data hack exposes secrets perpetually american town salem chaos descents four girls must fight survive coping hack themselves,1,0
645,645,22331,broadcast news,james l brooks,take two rival television reporters one handsome one talented male add one producer female mix well watch sparks fly,133,1987,20000000,"Comedy, Drama, Romance",1,0,0,0,0,0,1,0,0,0,0,1,0,0,0,0,0,0,0,1,0,0,broadcast news james l brooks take two rival television reporters one handsome one talented male add one producer female mix well watch sparks fly,1,1
1608,1608,30279,trojan war,george huang,brad hook girl dreams runs problem condom so brad sets night find one running many obstacles along way knowing best friend leah love him,84,1997,15000000,Comedy,0,0,0,0,0,0,1,0,0,0,0,0,0,0,0,0,0,0,0,0,0,0,trojan war george huang brad hook girl dreams runs problem condom so brad sets night find one running many obstacles along way knowing best friend leah love him,1,0
188,188,17700,blue collar,paul schrader,when three workers try steal local union discover corruption union instead decide blackmail them,114,1978,1700000,"Crime, Drama",1,0,0,0,0,0,0,0,0,0,0,1,0,0,0,0,1,0,0,0,0,0,blue collar paul schrader when three workers try steal local union discover corruption union instead decide blackmail them,0,0
555,555,21901,invaders from mars,tobe hooper,a boy tries stop aliens taken town attempting brainwash inhabitants,100,1986,12000000,"Horror, Sci-Fi",0,0,0,0,0,1,0,0,0,0,0,0,0,1,0,0,0,0,0,0,0,0,invaders from mars tobe hooper a boy tries stop aliens taken town attempting brainwash inhabitants,1,0
111,111,16198,the texas chain saw massacre,tobe hooper,two siblings three friends en route visit grandfathers grave texas end falling victim family cannibalistic psychopaths and must survive terrors leatherface family,83,1974,300000,Horror,1,0,0,0,0,0,0,0,0,0,0,0,0,1,0,0,0,0,0,0,0,0,the texas chain saw massacre tobe hooper two siblings three friends en route visit grandfathers grave texas end falling victim family cannibalistic psychopaths and must survive terrors leatherface family,1,1
1335,1335,27197,dumb and dumber,peter farrelly bobby farrelly,after woman leaves briefcase airport terminal dumb limo driver dumber friend set hilarious crosscountry road trip aspen return briefcase owner,107,1994,17000000,Comedy,1,0,0,0,0,0,1,0,0,0,0,0,0,0,0,0,0,0,0,0,0,0,dumb and dumber peter farrelly bobby farrelly after woman leaves briefcase airport terminal dumb limo driver dumber friend set hilarious crosscountry road trip aspen return briefcase owner,1,1
4191,4191,62543,the accountant,gavin oconnor,as math savant uncooks books new client treasury department closes activities body count starts rise,128,2016,44000000,"Action, Crime, Drama",1,0,0,1,0,0,0,0,0,0,0,1,0,0,0,0,1,0,0,0,0,0,the accountant gavin oconnor as math savant uncooks books new client treasury department closes activities body count starts rise,0,0
518,518,21232,fletch,michael ritchie,irwin m fletch fletcher newspaper reporter offered large sum cancerous millionaire run risking job finding clues clear man healthy,98,1985,8000000,"Comedy, Crime, Mystery",1,0,0,0,1,0,1,0,0,0,0,0,0,0,0,0,1,0,0,0,0,0,fletch michael ritchie irwin m fletch fletcher newspaper reporter offered large sum cancerous millionaire run risking job finding clues clear man healthy,0,0
2676,2676,45740,invincible,ericson core,based story vince papale 30yearold bartender south philadelphia overcame long odds play nfls philadelphia eagles 1976,105,2006,40000000,"Biography, Drama, Sport",1,0,1,0,0,0,0,0,1,0,0,1,0,0,0,0,0,0,0,0,0,0,invincible ericson core based story vince papale 30yearold bartender south philadelphia overcame long odds play nfls philadelphia eagles 1976,1,1
3622,3622,48479,jack reacher,christopher mcquarrie,a homicide investigator digs deeper case involving trained military sniper shot five random victims,130,2012,60000000,"Action, Crime, Thriller",1,0,0,1,0,0,0,0,0,1,0,0,0,0,0,0,1,0,0,0,0,0,jack reacher christopher mcquarrie a homicide investigator digs deeper case involving trained military sniper shot five random victims,1,1
1179,1179,26804,ruby in paradise,victor nunez,a young woman struggles independence identity small florida tourist town,114,1993,800000,"Drama, Romance",1,0,0,0,0,0,0,0,0,0,0,1,0,0,0,0,0,0,0,1,0,0,ruby in paradise victor nunez a young woman struggles independence identity small florida tourist town,1,1
2720,2720,46555,you me and dupree,anthony russo joe russo,a best man wilson stays houseguest newlyweds much couples annoyance,110,2006,54000000,"Comedy, Romance",1,0,0,0,0,0,1,0,0,0,0,0,0,0,0,0,0,0,0,1,0,0,you me and dupree anthony russo joe russo a best man wilson stays houseguest newlyweds much couples annoyance,1,1
3522,3522,52449,green lantern,martin campbell,reckless test pilot hal jordan granted alien ring bestows otherworldly powers inducts intergalactic police force green lantern corps,114,2011,200000000,"Action, Adventure, Sci-Fi",1,0,0,1,0,1,0,0,0,0,0,0,1,0,0,0,0,0,0,0,0,0,green lantern martin campbell reckless test pilot hal jordan granted alien ring bestows otherworldly powers inducts intergalactic police force green lantern corps,1,1
3151,3151,52300,crank high voltage,mark neveldine brian taylor,chelios faces chinese mobster stolen nearly indestructible heart replaced batterypowered ticker requires regular jolts electricity keep working,96,2009,20000000,"Action, Crime, Thriller",1,0,0,1,0,0,0,0,0,1,0,0,0,0,0,0,1,0,0,0,0,0,crank high voltage mark neveldine brian taylor chelios faces chinese mobster stolen nearly indestructible heart replaced batterypowered ticker requires regular jolts electricity keep working,1,1
230,230,19005,the stunt man,richard rush,a fugitive stumbles movie set need new stunt man takes job way hide falls leading lady,131,1980,3500000,"Action, Comedy, Drama",1,0,0,1,0,0,1,0,0,0,0,1,0,0,0,0,0,0,0,0,0,0,the stunt man richard rush a fugitive stumbles movie set need new stunt man takes job way hide falls leading lady,1,1
3219,3219,46283,land of the lost,brad silberling,on latest expedition dr rick marshall sucked spacetime vortex alongside research assistant redneck survivalist in alternate universe trio make friends primate named chaka ally world full dinosaurs fantastic creatures,102,2009,100000000,"Action, Adventure, Comedy",0,0,0,1,0,0,1,0,0,0,0,0,1,0,0,0,0,0,0,0,0,0,land of the lost brad silberling on latest expedition dr rick marshall sucked spacetime vortex alongside research assistant redneck survivalist in alternate universe trio make friends primate named chaka ally world full dinosaurs fantastic creatures,1,0
3262,3262,49958,bride wars,gary winick,two best friends become rivals schedule respective weddings day,89,2009,30000000,"Comedy, Romance",1,0,0,0,0,0,1,0,0,0,0,0,0,0,0,0,0,0,0,1,0,0,bride wars gary winick two best friends become rivals schedule respective weddings day,1,1
58,58,13125,the producers,mel brooks,producers max bialystock leo bloom make money producing surefire flop,88,1967,941000,"Comedy, Music",0,0,0,0,0,0,1,0,0,0,0,0,0,0,0,0,0,1,0,0,0,0,the producers mel brooks producers max bialystock leo bloom make money producing surefire flop,0,1
2341,2341,40599,daddy day care,steve carr,two men get laid become stayathome dads cant find jobs this inspires open daycare center,92,2003,60000000,"Comedy, Family",1,0,0,0,0,0,1,0,0,0,0,0,0,0,0,0,0,0,1,0,0,0,daddy day care steve carr two men get laid become stayathome dads cant find jobs this inspires open daycare center,1,1
3274,3274,50139,crossing over,wayne kramer,crossing over illegal aliens many nationalities los angeles area authorities individuals dealing them,113,2009,19000000,"Crime, Drama",0,0,0,0,0,0,0,0,0,0,0,1,0,0,0,0,1,0,0,0,0,0,crossing over wayne kramer crossing over illegal aliens many nationalities los angeles area authorities individuals dealing them,1,0
662,662,22627,malone,harley cokeliss,an excia hitman running past malone finds difficult retire runs accross small town controlled mercenaries family thats resisting ,92,1987,10000000,"Action, Drama, Thriller",0,0,0,1,0,0,0,0,0,1,0,1,0,0,0,0,0,0,0,0,0,0,malone harley cokeliss an excia hitman running past malone finds difficult retire runs accross small town controlled mercenaries family thats resisting ,1,0
1885,1885,32968,stir of echoes,david koepp,after hypnotized sisterinlaw man begins seeing haunting visions girls ghost mystery begins unfold around him,99,1999,12000000,"Horror, Mystery, Thriller",1,0,0,0,1,0,0,0,0,1,0,0,0,1,0,0,0,0,0,0,0,0,stir of echoes david koepp after hypnotized sisterinlaw man begins seeing haunting visions girls ghost mystery begins unfold around him,1,1
4119,4119,77198,george takeis allegiance,lorenzo thione,allegiance illuminates one american historys lesser known chapters tells story sam kimura transported back nearly six decades younger self sister kei ,130,2016,1000000,Musical,0,0,0,0,0,0,0,0,0,0,0,0,0,0,1,0,0,1,0,0,0,0,george takeis allegiance lorenzo thione allegiance illuminates one american historys lesser known chapters tells story sam kimura transported back nearly six decades younger self sister kei ,1,0
1235,1235,26501,geronimo an american legend,walter hill,the story apache chief armed resistance us governments subjugation people,115,1993,35000000,"Drama, History, Western",0,0,0,0,0,0,0,0,0,0,0,1,0,0,0,1,0,0,0,0,1,0,geronimo an american legend walter hill the story apache chief armed resistance us governments subjugation people,0,1
